{
  "$schema": "https://json-schema.org/draft/2020-12/schema",
  "$id": "https://fortebio.tech/schemas/ingest-reader.schema.json",
  "title": "Forte Rapid Reader → Engineer Server: bản ghi kết quả đo (type_Upload = reader_result)",
  "description": "Payload do firmware/FBT-Reader (src/engineerApi.cpp, từ v2.6.8 — kế hoạch firmware/FBT-Reader/docs/plan/2026-09-18-gui-du-lieu-engineer-server.md) sinh khi POST ingest với Bearer token, gửi SONG SONG với hàng Google Sheet (payload Sheet giữ nguyên, không theo schema này). Reader là máy 1 khe quang: dùng CÙNG quy ước N-khe của rapid4p (`slots` + mảng slot_*/calib_* đúng `slots` phần tử — server/app/logic.py::validate kiểm chéo) với `slots` ghim 1, để server/app/ERP xử lý Reader như rapid4p 1 khe, không cần nhánh riêng. Ba số đọc thô của một lần đo nằm ở `readings` (không thuộc SLOT_ARRAY_FIELDS nên không bị đòi = slots). Lần đo lỗi cảm biến CŨNG gửi (verdict E) — quyết định 2026-09-18.",
  "type": "object",
  "required": ["id_device", "product", "type_Upload", "group", "sick", "sample", "slots", "slot_result", "slot_positive", "readings", "readings_ok", "threshold", "verdict", "time"],
  "properties": {
    "id_device":     { "type": "string", "minLength": 1, "maxLength": 24, "description": "Mã máy nhập qua WiFiManager / cổng web (EEPROM 40..59), tiền tố RE (registry). Còn là mặc định 'RE' chưa cấu hình → firmware gửi 'RE-' + 6 hex cuối MAC để không gộp máy trên /devices" },
    "version":       { "type": "string", "pattern": "^v\\d+\\.\\d+\\.\\d+", "description": "FirmwareVer (src/define.h)" },
    "product":       { "const": "reader" },
    "hw":            { "type": "string", "description": "Phiên bản PCB — rỗng cho tới khi registry chốt `hw` (không bịa)" },
    "mac":           { "type": "string", "pattern": "^[0-9A-F]{12}$", "description": "WiFi.macAddress() bỏ dấu ':' — truy máy khi id_device bị nhập trùng" },
    "method":        { "const": "append" },
    "type_Upload":   { "const": "reader_result" },
    "group":         { "type": "string", "enum": ["Prawn", "Fish", "Pig", "Chicken"], "description": "animals.groupName (Sample.cpp) — nhóm vật nuôi, snapshot lúc đo" },
    "sick":          { "type": "string", "enum": ["PC", "EHP", "EMS", "WSSV", "TPD", "ISKNV", "TILV", "ASF"], "description": "listSick[].sickName — khoá bệnh, không dịch, không ghép chuỗi như payload Sheet" },
    "sample":        { "type": "string", "maxLength": 15, "description": "sampleNames[] (char[15]): P.Vannamei, P.Monodon, Water, Fish, Blood, Feces, Saliva, Chicken" },
    "slots":         { "const": 1, "description": "Reader có ĐÚNG 1 khe quang (TCS34725)" },
    "slot_result":   { "type": "array", "items": { "type": "integer", "minimum": 0 }, "minItems": 1, "maxItems": 1, "description": "[AverageResult] — trung bình 3 lần đọc" },
    "slot_positive": { "type": "array", "items": { "type": "boolean" }, "minItems": 1, "maxItems": 1, "description": "[avg >= threshold]; lần đo lỗi → [false]" },
    "readings":      { "type": "array", "items": { "type": "integer", "minimum": 0 }, "minItems": 3, "maxItems": 3, "description": "result_Sensor[0][0..2] — 3 số đọc thô, thứ trả lời 'vì sao dương tính' sáu tháng sau" },
    "readings_ok":   { "type": "array", "items": { "type": "boolean" }, "minItems": 3, "maxItems": 3, "description": "sensorError[0..2] đảo dấu: true = lần đọc đó hợp lệ" },
    "threshold":     { "type": "integer", "minimum": 0, "maximum": 65535, "description": "listSick[sick].threshold LÚC ĐO (uint16 EEPROM; có thể bị đổi sau qua settingThreshold)" },
    "verdict":       { "type": "string", "enum": ["P", "N", "E"], "description": "P dương tính / N âm tính / E lỗi cảm biến (resultChar 'X')" },
    "calib_min":     { "type": "array", "items": { "type": "integer", "minimum": 0 }, "minItems": 1, "maxItems": 1, "description": "[valueCalibMin] — cùng tên mảng với rapid4p (SLOT_ARRAY_FIELDS)" },
    "calib_max":     { "type": "array", "items": { "type": "integer", "minimum": 0 }, "minItems": 1, "maxItems": 1, "description": "[valueCalibMax]" },
    "slope":         { "type": "number", "description": "Hiệu chuẩn tuyến tính (EEPROM ADDR_SLOPE) — riêng Reader" },
    "origin":        { "type": "number", "description": "EEPROM ADDR_ORIGIN — riêng Reader" },
    "rsq":           { "type": "number", "minimum": 0, "maximum": 1, "description": "R² của lần hiệu chuẩn" },
    "group_id":      { "type": "integer", "minimum": 0, "description": "Bộ đếm EEPROM tăng 1 mỗi lần người dùng MỞ nhóm; 0 = đo ngoài nhóm. Khoá nhóm = (id_device, group_id). Thay cho hàng giả ST/EN của Sheet" },
    "time":          { "type": "string", "description": "getTime(): 'DD-MM-YYYY HH:MM:SS' giờ VN (server parse → received_at) hoặc 'N/A' khi chưa có NTP (server dùng now())" }
  },
  "additionalProperties": true
}
