{
  "id_device": "RE0012",
  "version": "v2.6.8",
  "product": "reader",
  "hw": "",
  "mac": "A4CF12AB34CD",
  "method": "append",
  "type_Upload": "reader_result",
  "group": "Prawn",
  "sick": "WSSV",
  "sample": "P.Vannamei",
  "slots": 1,
  "slot_result": [812],
  "slot_positive": [true],
  "readings": [805, 814, 817],
  "readings_ok": [true, true, true],
  "threshold": 600,
  "verdict": "P",
  "calib_min": [0],
  "calib_max": [3000],
  "slope": 1.0,
  "origin": 0.0,
  "rsq": 0.998,
  "group_id": 17,
  "time": "18-09-2026 10:22:33"
}
